Date,Text,Username,Id,Permalink,Retweets,Favorites
11/2/15 18:59,"Will you have out-of-towners visit for the holidays? If they're looking for hotel accommodations, Country Inn &... http://fb.me/7CJ04dRLD",townesathollyst,6.61332E+17,https://twitter.com/townesathollyst/status/661331789378682880,0,0
11/3/15 18:00,Are The Crappie Calling You To Bay Springs Country Inn & Campground? And Yes They Are Biting ;-) Book Your Rooms... http://fb.me/3foYSzrET,BaySpringsMotel,6.61679E+17,https://twitter.com/BaySpringsMotel/status/661679252257898497,0,0
11/4/15 18:20,"Made it to Cedar Rapids! I forgot how long the drive is... — feeling tired at Country Inn & Suites By Carlson,... http://fb.me/3gFFItxg4",NeRdZiLlA_04,6.62047E+17,https://twitter.com/NeRdZiLlA_04/status/662046881782960129,0,0
11/5/15 18:35,Visiting # SaintAugustine this summer? Stay in Country Inn & Suites Downtown Saint Augustine:,HotelCrow,6.62413E+17,https://twitter.com/HotelCrow/status/662413037593210880,1,0
11/6/15 18:58,We love working with Wine Country Flowers. Here is a collection of their fabulous work at Vintners Inn! http://fb.me/4uP4cvkw4,VintnersInn,6.62781E+17,https://twitter.com/VintnersInn/status/662781071839248384,0,0
11/7/15 18:40,"We're looking for some great people!! Are you reliable, self motivated, and available for evenings, weekends and... http://fb.me/4RhFfHsSP",CountryInn_Albl,6.63139E+17,https://twitter.com/CountryInn_Albl/status/663139044830928898,0,0
11/8/15 17:29,Our hotel deal of the day is Country Inn & Suites West Beaufort located in # Beaufort. Book it today:,HotelCrow,6.63483E+17,https://twitter.com/HotelCrow/status/663483474804760576,2,0
11/9/15 17:53,"Lindsay & Chris got married at Circle S Ranch & Country Inn this past weekend, and what a beautiful day it was!... http://fb.me/44U9KP3kt",AMHoccasions,6.63852E+17,https://twitter.com/AMHoccasions/status/663851865625374721,0,0
11/10/15 18:39,B & B Country Garden in NC Inn rocks for vets! pic.twitter.com/ADgwlJ7lK1,toygoddess,6.64226E+17,https://twitter.com/toygoddess/status/664225803589312513,0,2
11/11/15 18:46,Thank you to all who have so bravely served our country from all of us at the Hampton Inn & Suites # VeteransDaypic.twitter.com/FSDTwA6Zrf,HamptonTruckee,6.6459E+17,https://twitter.com/HamptonTruckee/status/664590157979344896,0,1
11/12/15 18:11,# Chef # Chefjobs Commis Chef Country Inn # AArosette # Reading # Berkshire 17K # Jobs Apply Here http://chefjob.co/CSM34129 pic.twitter.com/sITvmOwM43,Chef_Selection,6.64944E+17,https://twitter.com/Chef_Selection/status/664943699432869888,1,1
11/13/15 18:20,Visiting # Decatur(Illinois) this summer? Stay in Country Inn & Suites Decatur (Illinois):,HotelCrow,6.65308E+17,https://twitter.com/HotelCrow/status/665308303556149248,0,0
11/14/15 18:54,All pretty for Dan and Katie's wedding!!! # whohatesiowa @Country Inn &… https://instagram.com/p/-FZtztywdRWa7oItKbLhB6deJjfm97Qur74Zs0/ …,ajk3186,6.65679E+17,https://twitter.com/ajk3186/status/665679199190065152,0,0
11/15/15 18:46,"Last night. # UZN42 (@Country Inn & Suites By Carlson in Elizabeth, NJ) https://www.swarmapp.com/c/9C2UMaQZic4",DJGMAC,6.6604E+17,https://twitter.com/DJGMAC/status/666039670984286208,0,0
11/16/15 18:53,Cerveza Imperial # LaCervezaDeCostaRica :) @Country Inn & Suites Cariari https://instagram.com/p/-KjN25HYVACppe9Wvfz7Xs87OPmZ0z6FVQZVc0/ …,monicalunaortiz,6.66404E+17,https://twitter.com/monicalunaortiz/status/666403780049641473,0,0
11/17/15 18:41,"Editing ""Ian Got Left At The Alter"" # screenplay # day2 # ipadair # dinnertime @Country Pizza Inn, New… https://instagram.com/p/-NGqvkiD90/",RobertJbuyea,6.66763E+17,https://twitter.com/RobertJbuyea/status/666763211912429568,0,0
11/18/15 18:55,# nofilter # puremichigan @Castle in the Country Bed & Breakfast Inn https://instagram.com/p/-PtCrCyDI6/,stevejacus,6.67129E+17,https://twitter.com/stevejacus/status/667129072418430977,0,0
11/19/15 18:41,"I'm at Country Inn & Suites by Carlson in Iron Mountain, MI https://www.swarmapp.com/c/kvF1aO0vCgN",The_Signal42,6.67488E+17,https://twitter.com/The_Signal42/status/667487966420447232,0,0
11/20/15 18:54,First snowfall going on now! http://fb.me/7U60ZYOKI,CountryInn_Albl,6.67854E+17,https://twitter.com/CountryInn_Albl/status/667853603164454912,0,0
11/21/15 18:30,Pit Lizards since 1964! @Town and Country Inn and Resort https://instagram.com/p/-XYhmNDe0KGm7lOwq39Z9Mcy3HKPbJgiZHVWk0/ …,minkennett,6.6821E+17,https://twitter.com/minkennett/status/668209862065582080,1,0
11/22/15 18:57,Look at bae Ass looking innocent @Rip's Country Inn https://instagram.com/p/-aAe_UN9Fo/,AYE_PHATZ,6.68579E+17,https://twitter.com/AYE_PHATZ/status/668579201159708672,0,0
11/23/15 18:29,"I'm at Country Inn & Suites By Carlson, Panama in Panamá https://www.swarmapp.com/c/0xWCHn8h73r",Stanlopez18,6.68934E+17,https://twitter.com/Stanlopez18/status/668934485065510912,0,0
11/24/15 18:38,Flying out of @ mspairport and need a place to park? Inquire about our Park and Fly rates today!!,CountryInn_BLOM,6.69299E+17,https://twitter.com/CountryInn_BLOM/status/669298965397966848,0,0
11/25/15 18:55,Reminder: KI Downtown closed tomorrow! Reopening Friday at 7am. KI Country open tomorrow from 5-8pm only! Normal operating hours on Friday!,Kenl_Inn,6.69666E+17,https://twitter.com/Kenl_Inn/status/669665699581837312,0,0
11/26/15 18:31,Are you spending # Thanksgiving at home or are you traveling? http://ow.ly/V3U5S,countryinn,6.70022E+17,https://twitter.com/countryinn/status/670022043639914496,0,0
11/27/15 18:26,Derbyshire Country Inn – £119 from Living Social http://www.thestowonline.com/daily-deals/derbyshire-country-inn-119-from-living-social/ …pic.twitter.com/YBhhf0HI9m,ukdealsonline,6.70383E+17,https://twitter.com/ukdealsonline/status/670383190343725056,0,0
11/28/15 18:07,Alan F.'s Review of Old Country Inn Restaurant - Unionville (4/5) on Yelp: This place always has great service.… http://dlvr.it/CscW1R,yorkregionnews,6.70741E+17,https://twitter.com/yorkregionnews/status/670740716318920705,0,0
11/30/15 18:56,"Please don't forget about High Country Inn's ""Burn the Mortgage"" celebration this coming Friday, December 4, with... http://fb.me/Tvu4fCx5",orofino_chamber,6.71478E+17,https://twitter.com/orofino_chamber/status/671477965595643904,0,0
12/1/15 18:57,"17 Country Pubs That Are Worth The Journey Let’s go pubbing. Monty's Inn, Beaulieu. If you want bucolic, this p… http://ift.tt/1PYMCIk",MorenoRen3,6.7184E+17,https://twitter.com/MorenoRen3/status/671840465407385600,1,0
12/2/15 18:43,I checked in at Country Inn & Suites by Carlson-Stevens Point on # Yelp http://www.yelp.com/biz/country-inn-and-suites-by-carlson-stevens-point-stevens-point?pt=check_in&ref=twitter&utm_campaign=CheckIn&utm_medium=twitter&utm_source=ishare&v=4b …,indyjay,6.72199E+17,https://twitter.com/indyjay/status/672199327662473216,0,0
12/3/15 18:58,"I'm at Country Inn & Suites By Carlson, Charlotte I485 @Hwy 74E in Matthews, NC https://www.swarmapp.com/c/5rEGkEImeTJ",ITWebGuy13,6.72566E+17,https://twitter.com/ITWebGuy13/status/672565568378118145,0,0
12/4/15 18:01,Learn to Snowmobile in Ontario's Cottage Country http://fb.me/zhhyDrV2,rainbow_inn,6.72914E+17,https://twitter.com/rainbow_inn/status/672913757220245504,0,0
12/5/15 18:29,"wherr should i get my chinese food from, not chinese country inn cause they raised they delivery minimum to 18$ helllll no",jefferymuriel,6.73283E+17,https://twitter.com/jefferymuriel/status/673283048318758912,0,0
12/6/15 18:58,"We know we have an amazing New Year's Eve at HideAway Country Inn, but looks like lunch on New Year's Day will be... http://fb.me/1rIX2UA1s",HideawayInn,6.73653E+17,https://twitter.com/HideawayInn/status/673652679973867521,0,0
12/7/15 18:00,Come # WinterCamping And Have Some Fun This Fall At Bay Springs Country Inn & Campground - Our Campground is... http://fb.me/4ljU3Wqv7,BaySpringsMotel,6.74E+17,https://twitter.com/BaySpringsMotel/status/674000443656306689,0,0
12/8/15 18:15,"Langstrath Country Inn, Stonethwaite, Borrowdale from June 2015 https://themofad.wordpress.com/2015/06/28/langstrath-country-inn-stonethwaite-borrowdale …pic.twitter.com/2ZAdTw1dcs",The_MOFAD,6.74367E+17,https://twitter.com/The_MOFAD/status/674366673336578049,0,0
12/9/15 18:41,# Chef # Chefjob Chef de Partie Country Inn # Reading # Berkshire # AArosette 19K Apply Here http://chefjob.co/CSM34139 pic.twitter.com/efz3vt04Gm,Chef_Selection,6.74736E+17,https://twitter.com/Chef_Selection/status/674735635089911808,0,2
12/10/15 18:41,@ InSouthFlorida @ WWAmpSoftball Country Inn & Suites Director of Sales will be supporting our Wounded Warriors Dont miss it.,carmen_layne,6.75098E+17,https://twitter.com/carmen_layne/status/675098153792729089,0,0
12/11/15 18:41,Need THE best # hotel while staying in # CarterLake? Country Inn & Suites Omaha Airport Carter Lake is your choice!,HotelCrow,6.7546E+17,https://twitter.com/HotelCrow/status/675460439535316993,0,0
12/12/15 18:21,# Chef # Chefjobs Commis Chef Country Inn # AArosette # Reading # Berkshire 17K # Jobs Apply Here http://chefjob.co/CSM34129 pic.twitter.com/rmJLR05JUP,Chef_Selection,6.75818E+17,https://twitter.com/Chef_Selection/status/675817745582186497,0,0
12/13/15 18:37,"Bangor, Maine's Country Inn At The Mall - The country feel with the city advantage. # TravelWithTully http://goo.gl/QcQP0G via @ Tullyman77",CanadianMomEh,6.76184E+17,https://twitter.com/CanadianMomEh/status/676184091084136448,1,2
12/14/15 18:53,Country inn Milky House http://goo.gl/fb/UB3HkE,hotelsfollow,6.7655E+17,https://twitter.com/hotelsfollow/status/676550499563397121,0,0
12/15/15 18:38,"I'm at Country Inn & Suites by Carlson in Iron Mountain, MI https://www.swarmapp.com/c/9CIFPiyuuQq",The_Signal42,6.76909E+17,https://twitter.com/The_Signal42/status/676909233863028736,0,0
12/16/15 18:59,@1practicalsoul @ SpaceshipsLB 1 more minute! # RestComesEasySweepstakes,countryinn,6.77277E+17,https://twitter.com/countryinn/status/677276819041730560,0,1
12/17/15 18:46,This Saturday Country club commandos are bringing the party to the Woodstock Inn! We'll be taking food donations... http://fb.me/VpVLvXS2,zachcauley86,6.77636E+17,https://twitter.com/zachcauley86/status/677635985291780097,0,0
12/18/15 18:33,The best deal in Plymouth! Get a $50 value for free when you book our Home Suite Home package. Book this Sweet... http://fb.me/VN1iVQjL,CountryInn_PLYH,6.77995E+17,https://twitter.com/CountryInn_PLYH/status/677995041646731264,0,0
12/19/15 18:07,Drinking a Copper Ale by Elk Creek Cafe + Aleworks @Sonestown Country Inn — http://untp.beer/s/c257096397,dkepner,6.78351E+17,https://twitter.com/dkepner/status/678350872292782080,0,0
12/20/15 18:53,Thought For Today: We did it! Country Inn & Suites sponsored The Jolly Trolly Ride through the festival of... http://fb.me/2tIe0lcqI,CountryInnWtnSD,6.78725E+17,https://twitter.com/CountryInnWtnSD/status/678724828363415552,0,0
12/21/15 18:37,Thought For Today: We did it! Country Inn & Suites sponsored The Jolly Trolly Ride through the festival of... http://fb.me/3GGvDqWDV,CountryInnWtnSD,6.79083E+17,https://twitter.com/CountryInnWtnSD/status/679083351026847744,0,0
12/22/15 18:55,^ Shropshire+ | SHROPSHIRE – MAIN ROAD COUNTRY INN http://twib.in/l/jBG7BneqLGK # Salop # Shropshire,ShropsNews4U,6.7945E+17,https://twitter.com/ShropsNews4U/status/679450114683879424,0,0
12/24/15 18:31,"I'm at Country Inn & Suites By Carlson, Panama in Panamá https://www.swarmapp.com/c/4YXsq7edXBU",lfonseca4,6.80169E+17,https://twitter.com/lfonseca4/status/680168914530234370,0,0
12/25/15 18:59,Coming in from out of town to participate in the Zombie Run? Check out the Country Inn's Sleep Special! (763) 682-5660,macnamarasae,6.80538E+17,https://twitter.com/macnamarasae/status/680538404669517824,0,0
12/26/15 17:40,"Checkin in (@Country Inn & Suites - @ countryinns in West Seneca, NY) https://www.swarmapp.com/c/aKRPHMkZdFV",ZexSwain,6.80881E+17,https://twitter.com/ZexSwain/status/680880780374073345,0,1
12/27/15 18:25,"Fort Qu'appelle Country Squire Inn for New Years, who's in?",wmm67,6.81255E+17,https://twitter.com/wmm67/status/681254657516154881,0,1
12/28/15 17:47,"“Don't part with your illusions. When they are gone you may still exist, but you have ceased to live.” ― Mark Twain",CountryInn_VHMN,6.81607E+17,https://twitter.com/CountryInn_VHMN/status/681607496318889984,0,0
12/31/15 18:27,"New year party with Suboni brothers at country inn n suites,delhi",djnikhilattri,6.82705E+17,https://twitter.com/djnikhilattri/status/682704552907296768,0,0
1/1/16 18:17,Country Inn & Suites Florence (South Carolina) is one of the best budget # hotels in whole # UnitedStates!,HotelCrow,6.83064E+17,https://twitter.com/HotelCrow/status/683064425146798080,0,0
1/2/16 18:15,@ LastStop_CALI country host Inn.,dicedaplug,6.83426E+17,https://twitter.com/dicedaplug/status/683426468303605761,0,0
1/3/16 18:40,Still my squad @Country Inn and Suites University Area https://www.instagram.com/p/BAGH1QzyF8O/,mitchell_farah,6.83795E+17,https://twitter.com/mitchell_farah/status/683795008663760904,0,0
1/4/16 18:29,The first trip ay the USA @Valley Inn Country Club https://www.instagram.com/p/BAIrZ5-lfOXvCE6JRGPnoKREqtuJG5Q9C3ZOFA0/ …,Albert_Galindo,6.84155E+17,https://twitter.com/Albert_Galindo/status/684154714796081153,0,0
1/5/16 18:37,Need THE best # hotel while staying in # Manteno? Country Inn & Suites Manteno (Illinois) is your choice!,HotelCrow,6.84519E+17,https://twitter.com/HotelCrow/status/684519223419256832,0,0
1/6/16 18:54,There is no better way to celebrate # HOF inductions than a stay at HideAway Country Inn before heading to... http://fb.me/xgmIiM9g,HideawayInn,6.84886E+17,https://twitter.com/HideawayInn/status/684885827462103040,0,0
1/7/16 18:41,Checking in (@Bear Country Inn) https://www.swarmapp.com/c/bdWhIJMlXFz,Austimus_P,6.85245E+17,https://twitter.com/Austimus_P/status/685244990524620800,0,0
1/8/16 18:58,Country Inn & Suites Downtown South at Turner Field on # Yelp: Comes with a microwave and refrigerator http://www.yelp.com/biz_photos/country-inn-and-suites-downtown-south-at-turner-field-atlanta?pt=biz_photo&ref=twitter&select=wXnAiK8oc2UWdxzbm05l4g …,Mzshortee5,6.85611E+17,https://twitter.com/Mzshortee5/status/685611447301222400,0,0
1/9/16 18:58,"Hello, Mr. Bixby...and so we meet again (@Country Inn and Suites) on # Yelp http://ln.is/www.yelp.com/biz/a0Rxy …",Momofthatdream,6.85974E+17,https://twitter.com/Momofthatdream/status/685973941131816961,0,0
1/10/16 18:42,Uncle Ben’s Country Inn Rice Just $.75 at Walmart! pic.twitter.com/2PRDmcSw3a http://ift.tt/1JE3DFT pic.twitter.com/LFC32Kk9zq,BabyBoomerRants,6.86332E+17,https://twitter.com/BabyBoomerRants/status/686332375719112704,0,0
1/11/16 18:51,"# Relax # pool # Jacuzzi @Country Inn & Suites by Carlson, Panama… https://www.instagram.com/p/BAavipunjFA5xSKqjFfRmXvmv-NdvoPXNpWHy80/ …",jesury12,6.86697E+17,https://twitter.com/jesury12/status/686697081491296257,0,0
1/12/16 18:42,"Arizona this week, come say hello: CFA Wednesday, 11:45a -1:30p, Phoenix Country Club, Phoenix Thursday, 4:00p -5:00p, Arizona Inn, Tucson",MebFaber,6.87057E+17,https://twitter.com/MebFaber/status/687057207049891840,3,2
1/13/16 18:00,Country Inn and Suites Metairie Louisiana is the perfect place to stay! # CountryInnsMetairie # VisitJeffersonParish http://www.smslwithheidi.com/country-inn-and-suites-metairie-louisiana/ …,lifewithheidig,6.87409E+17,https://twitter.com/lifewithheidig/status/687408819803144192,0,0
1/14/16 18:58,"I'm at The New Country Boy Inn in Milledgeville, GA https://www.swarmapp.com/c/24EnWugq6dp",jasonb0077,6.87786E+17,https://twitter.com/jasonb0077/status/687785840169381889,0,0
1/15/16 17:35,"The only bad thing, there is a one man band with a synth playing country songs, badly, like holiday inn lounge bad",Dusty_Kat,6.88127E+17,https://twitter.com/Dusty_Kat/status/688127366934073348,0,10
1/16/16 18:55,"If you're an outdoor type, here are tips for trails whether it's snowshoeing w/Dogs, hiking or cross-country skiing. http://ow.ly/3a4gvO",Kenl_Inn,6.8851E+17,https://twitter.com/Kenl_Inn/status/688509845968957440,0,0
1/17/16 18:21,"Drinking an Amber Eh! by @ NiagaraBrewCo @Country Inn & Suites By Carlson, Niagara Falls, ON — http://untp.beer/s/c268121077",TivoliJones,6.88864E+17,https://twitter.com/TivoliJones/status/688863759180414978,0,2
1/18/16 18:58,"Local Jobs: Hackney's, Domino's, Country Inn and Suites, Holy Family Villa, Silver Cross… http://dlvr.it/DJwP2j pic.twitter.com/vo5GNKN1Tj",BeverlyMtGPatch,6.89235E+17,https://twitter.com/BeverlyMtGPatch/status/689235460741148672,0,1
1/20/16 18:00,Our Campground At Bay Springs Country Inn & Campground is located on the water about 200 feet from our Country... http://fb.me/3jVwqpMHM,BaySpringsMotel,6.89946E+17,https://twitter.com/BaySpringsMotel/status/689945506676613124,0,0
1/21/16 18:57,I am relaxing at my hotel before the concert. Karaoke at the Country Inn before the show. Yes!,ansprinkles,6.90322E+17,https://twitter.com/ansprinkles/status/690322271324508160,0,0
1/22/16 18:42,"Having a delicious lunch, breakfast-style, with the cuzz. Nomnomnom! This was at the Holder’s Country Inn. (1-21-16) pic.twitter.com/x5yQInWAvT",54stormywill54,6.90681E+17,https://twitter.com/54stormywill54/status/690680977991970816,0,0
1/23/16 18:27,"HyVee Christmas party with my lady (@Country Inn & Suites By Carlson, Mankato, MN in Mankato, MN) https://www.swarmapp.com/c/7X0Lgk5KMvE",MikeWBidwell,6.9104E+17,https://twitter.com/MikeWBidwell/status/691039683330101248,0,0
1/24/16 18:09,"@ aunlou I am sorry to hear about this, Aundrea! Could you please DM me with your stay details so that I may assist you? ~Mike",countryinn,6.91397E+17,https://twitter.com/countryinn/status/691397349806051329,0,0
1/25/16 18:30,top rated web-wide Country Inn & Suites By Carlson Moline Airport: 2721 69th Avenue Ct MOLINE IL http://bit.ly/1lM1xIC customer's choice,topratedhotels,6.91765E+17,https://twitter.com/topratedhotels/status/691765200358391809,0,0
1/26/16 18:51,Can you guess the # airline with the best # food? http://bit.ly/1Rp8j4E pic.twitter.com/d1ahdXnwc4,CountryInn_EGV,6.92133E+17,https://twitter.com/CountryInn_EGV/status/692132695384707072,0,1
1/27/16 17:53,Thinking of you Mary Jo Brownson Morganti — eating lunch at Paniolo Country Inn http://fb.me/7uXdKaNSq,trgeorge,6.92481E+17,https://twitter.com/trgeorge/status/692480614398873600,0,0
1/28/16 18:46,Need THE best # hotel while staying in # Appleton? Country Inn & Suites Appleton (Wisconsin) is your choice!,HotelCrow,6.92856E+17,https://twitter.com/HotelCrow/status/692856282210938880,0,0
1/31/16 18:13,Chef_Selection: Sous Chef Country Inn # Wisbech # KingsLynn # Cambridgeshire # Jobs Apply Here http://chefjob.co/CS3556A pic.twitter.com/nhhv5VcJrn,Smartjobs_in,6.93935E+17,https://twitter.com/Smartjobs_in/status/693935232848912384,0,0
2/1/16 18:56,Looking for the cure to an empty refrigerator? Answer: Stoll's Country Inn pic.twitter.com/LEKH3ElpkV,StollsCountry,6.94308E+17,https://twitter.com/StollsCountry/status/694308341636599808,0,0
2/2/16 18:30,"Sous Chef, Country Inn, £20,000, Grassington, North Yorkshire http://bit.ly/1RktllB",CJUKChefs,6.94664E+17,https://twitter.com/CJUKChefs/status/694664330936238081,0,0
2/3/16 18:00,Country Inn and Suites Metairie Louisiana is the perfect place to stay! # CountryInnsMetairie # VisitJeffersonParish http://www.smslwithheidi.com/country-inn-and-suites-metairie-louisiana/ …,lifewithheidig,6.95019E+17,https://twitter.com/lifewithheidig/status/695018952074903556,0,0
2/4/16 18:49,Visiting # Knoxville this summer? Stay in Country Inn & Suites West Knoxville: http://hotelcrow.com/Hotel/Country_Inn_Suites_West_Knoxville.htm …,HotelCrow,6.95394E+17,https://twitter.com/HotelCrow/status/695393769315651585,2,1
2/6/16 18:46,"Calistoga Inn Restaurant and Brewery is holding its annual Fat Tuesday with a special New Orleans Style Country Dinner on Tuesday, Feb. 9.",WeeklyCali,6.96118E+17,https://twitter.com/WeeklyCali/status/696117721013080064,0,1
2/7/16 18:37,DG Event: MRF conference at country inn and suites bhiwadi http://fb.me/77vwYs6aS,dj_videek,6.96478E+17,https://twitter.com/dj_videek/status/696477819438657536,0,0
2/8/16 17:31,"Coach Magayna and Knipp, along with Sbiral's, Hackett's, Reeds, and Funks are staying at Country Inn & Suites in... http://fb.me/6W67YupsA",sailormatclub,6.96824E+17,https://twitter.com/sailormatclub/status/696823689963302913,0,0
2/9/16 18:57,Country Inn & Suites Berea is one of the best budget # hotels in whole # UnitedStates! http://hotelcrow.com/Hotel/Country_Inn_Suites_Berea.htm …,HotelCrow,6.97208E+17,https://twitter.com/HotelCrow/status/697207750363734016,0,0
2/10/16 18:57,"# Bloomington # Jobs Front Desk Representative - Full-Time - Country Inn & Suites by Carlson - Bloomington, MN: ... http://tinyurl.com/hrowpea",BloomingtonJob,6.9757E+17,https://twitter.com/BloomingtonJob/status/697570022068072448,0,0
2/11/16 18:47,"Mother's Day | The Inn at Fossebridge, a Cotswold country house ... http://dlvr.it/KTg9tT",Cotswolds_Lover,6.9793E+17,https://twitter.com/Cotswolds_Lover/status/697929890209751040,0,0
2/12/16 18:33,eating dinner with my love at Silver Lake Country Inn http://fb.me/RT4wf4jR,TechRepairWI,6.98289E+17,https://twitter.com/TechRepairWI/status/698288794190159872,0,0
2/13/16 18:45,Spring break will be here before you know it! Here are 5 great destinations that are perfect for the whole family: http://bit.ly/1oxsUbf,countryinn,6.98654E+17,https://twitter.com/countryinn/status/698654140705202176,1,1
2/14/16 18:12,"I'm at Country Inn & Suites By Carlson, Pensacola West, FL in Pensacola, FL https://www.swarmapp.com/c/bwYLRs7AMqO",ademaracing2040,6.99008E+17,https://twitter.com/ademaracing2040/status/699008224935202817,0,0
2/16/16 18:15,GRAND JUNCTION COLORADO SABADO 27 DE FEB SALON EL TRAVELODGE ANTES EL COUNTRY INN CABALLOS Y INTEGRANTES DEL NORTE http://fb.me/4vzozgi8y,Caballosdelnort,6.99734E+17,https://twitter.com/Caballosdelnort/status/699733962458054659,0,0
2/17/16 17:57,Visiting # CampSprings this summer? Stay in Country Inn & Suites Camp Springs: http://hotelcrow.com/Hotel/Country_Inn_Suites_Camp_Springs.htm …,HotelCrow,7.00092E+17,https://twitter.com/HotelCrow/status/700091674936999936,1,0
2/18/16 18:41,Check Valerie Paige out this Saturday singing some of your favorite country hits. # countrysinger # clevelandmusic http://fb.me/5hCYBM3bI,Eastland_Inn,7.00465E+17,https://twitter.com/Eastland_Inn/status/700465198721667072,0,0
2/19/16 16:11,@ CureOurCountry yeah but you know some fools going start flying people from another country inn or another state just to vote,GhostDancer_2,7.0079E+17,https://twitter.com/GhostDancer_2/status/700789811376840704,0,0
2/20/16 18:49,Drinking a Belgian White by @ BlueMoonBrewCo @Country Inn & Suites By Carlson — http://untp.beer/s/c279680735,nmppeterson,7.01192E+17,https://twitter.com/nmppeterson/status/701191977535193089,0,0
2/22/16 17:58,Need THE best # hotel while staying in # Galloway? Country Inn & Suites Absecon Galloway is your choice!,HotelCrow,7.01904E+17,https://twitter.com/HotelCrow/status/701903898303295488,0,0
2/23/16 18:56,Which Country Has the Most # Silver?http://investingnews.com/daily/resource-investing/precious-metals-investing/silver-investing/10-top-silver-producing-countries/ …,INN_Silver,7.02281E+17,https://twitter.com/INN_Silver/status/702280822502588417,0,0
2/24/16 18:37,Visiting # RedWing this summer? Stay in Country Inn & Suites Red Wing: http://hotelcrow.com/Hotel/Country_Inn_Suites_Red_Wing.htm … # IAMOPL,HotelCrow,7.02638E+17,https://twitter.com/HotelCrow/status/702638473719779332,0,0
2/25/16 18:38,"$189 -- Kentucky Country Inn: 2 Nights w/Breakfast, 55% Off http://dlvr.it/KcS5xn",traveldaily,7.03001E+17,https://twitter.com/traveldaily/status/703001061087285250,0,0
2/26/16 18:44,# Country comfort boulevard motor inn ad Euro 110.51 in # Venere # Venere - Dettagli su http://ift.tt/21oak7f http://fb.me/2oQlUhBF6,acquefangose,7.03365E+17,https://twitter.com/acquefangose/status/703364937851281408,0,0
2/27/16 18:53,Taking on judging today as one of my last endeavors as your Miss Travel America. I'll be at Country Inn & Suites... http://fb.me/ZeM8m3GY,tourismpageant,7.0373E+17,https://twitter.com/tourismpageant/status/703729762775146496,0,0
2/28/16 18:43,"Sam Beall, a Restaurateur Who Took Fine Dining to the Farm, Dies at 39: Mr. Beall turned Blackberry Farm, his parents’ country inn in...",Moojund,7.0409E+17,https://twitter.com/Moojund/status/704089572670619649,0,0
2/29/16 18:50,Hotel Country Inn & Suites Ciudad de Panamá: http://youtu.be/Ave2NhcEsyY?a via @ YouTube,hotelesentv,7.04454E+17,https://twitter.com/hotelesentv/status/704453737260122112,0,0
3/1/16 18:59,Quality Inn Temecula Valley Wine Country http://tinyurl.com/jo3cc43,eTemeculaCA,7.04818E+17,https://twitter.com/eTemeculaCA/status/704818495029051394,0,0
3/2/16 18:15,That # ahhh feeling you get when you finally get to take your dress shoes off! # businesstravelpic.twitter.com/Gjj3WGQf28,countryinn,7.0517E+17,https://twitter.com/countryinn/status/705169578301779969,0,5
3/3/16 18:35,Country Inn and Suites Airport South Irving is one of the best budget # hotels in whole # UnitedStates!,HotelCrow,7.05537E+17,https://twitter.com/HotelCrow/status/705537203233882112,0,0
3/4/16 18:57,"Mr. Beall turned Blackberry Farm, his parents’ country inn in Tennessee, into a national destination and was a leader in the farm-to-table",EarlyNellie,7.05905E+17,https://twitter.com/EarlyNellie/status/705905106018037760,0,0
3/5/16 16:45,Trip to lakes country with a stop for lunch at the Inn.. What's a girl to do? Plan! # duh # noexcuses I stopped... http://fb.me/2HpXWgesA,SaraLau6,7.06234E+17,https://twitter.com/SaraLau6/status/706234142745354240,0,1
3/6/16 18:39,"Home for 6 days. (@Country Inn & Suites in Orlando, FL) https://www.swarmapp.com/c/cPSyXxfr6Rg",ceejdesilva,7.06625E+17,https://twitter.com/ceejdesilva/status/706625209298763776,0,1
