Date,Text,Username,Id,Permalink,Retweets,Favorites
4/7/13 19:47,Small fire at Country Inn in Ithaca: Firefighters responded to the fire about 8:30 a.m when they found smoke... http://dlvr.it/3BsRkd,syracusedaily,3.21047E+17,https://twitter.com/syracusedaily/status/321046679606398976,0,0
4/8/13 19:40,Hampton Inn Vanderbilt West End will be cheering the Country Music Marathon participants from the starting line!,HamptonWestEnd,3.21407E+17,https://twitter.com/HamptonWestEnd/status/321407209852502018,0,0
4/9/13 19:16,Country Pub Fare: Two Courses of Scottish Fare With Wine For Two or Four from £19 at The Mill Inn (Up to 63% O... http://bit.ly/Vph0ds,Travel_Glasgow,3.21764E+17,https://twitter.com/Travel_Glasgow/status/321763677248290817,0,0
4/10/13 19:55,Today was the last day of swim practice at Country Inn for some very special people competing in the Special... http://fb.me/2u6Cyq7jj,CountryInnMaine,3.22136E+17,https://twitter.com/CountryInnMaine/status/322135845417127937,0,0
4/13/13 19:37,Country Inn & Suites By Carlson St. Charles 94 http://datravelapp.com/chicago/hotels/country_inn_suites_by_carlson_st._charles.php … # Hotels # Maps # TheCheapPasses # TheCheappassess # datravelapp,garyandrus10,3.23218E+17,https://twitter.com/garyandrus10/status/323218292993032192,0,0
4/14/13 19:52,Shout out to @AndItsKristina for seeing her at Country Inn and her completing me on my dress.,andreaakay,3.23585E+17,https://twitter.com/andreaakay/status/323584543841992704,0,0
4/15/13 19:54,"I'm at Robke's Country Inn (Northport, Ny) http://4sq.com/137TL13",Tweetingrossi,3.23948E+17,https://twitter.com/Tweetingrossi/status/323947507161903104,0,0
4/16/13 19:35,Country Inn & Suites By Carlson St. Charles 94 http://datravelapp.com/chicago/hotels/country_inn_suites_by_carlson_st._charles.php … # Hotels # Maps # TheCheapPasses # TheCheappassess # datravelapp,alanburke20101,3.24305E+17,https://twitter.com/alanburke20101/status/324305049553604608,0,0
4/17/13 19:57,@MsDaniD24 country inn and suites,RANDO_22,3.24673E+17,https://twitter.com/RANDO_22/status/324672883995586561,0,0
4/18/13 19:56,Breakfasts at Country Inn are the best # oldfashioned # delicious,li_michael95,3.25035E+17,https://twitter.com/li_michael95/status/325035188956565506,0,1
4/19/13 19:50,Drinking a Kanc Country Maple Porter by Woodstock Inn Brewery — http://untp.it/11NlRee,Barley69,3.25396E+17,https://twitter.com/Barley69/status/325396016486576130,0,0
4/20/13 19:51,@CountryInn_NELA looking forward to my stay there in May...how close is the hotel from French qtr,DrRGBryant,3.25759E+17,https://twitter.com/DrRGBryant/status/325758582052233217,0,0
4/21/13 19:52,"At country inn,gettin it in for bird birthday",itsME_badazz,3.26121E+17,https://twitter.com/itsME_badazz/status/326121357718982657,0,0
4/22/13 19:43,Amazing # hotel experience at Best Western St. Jacobs Country Inn Waterloo in # Waterloo: http://hotelcrow.com/Deal/49674/Best_Western_St_Jacobs_Country_Inn_Waterloo …,HotelCrow,3.26481E+17,https://twitter.com/HotelCrow/status/326481307733483520,0,0
4/23/13 19:49,"I'm at Country Inn & Suites By Carlson, Cottage Grove, MN - @ countryinns (Cottage Grove, MN) http://4sq.com/12GCdqp",TheBarryONeill,3.26845E+17,https://twitter.com/TheBarryONeill/status/326845404509532160,0,0
4/25/13 19:55,Jam band @cook forest country inn,BurnsRobertJ,3.27572E+17,https://twitter.com/BurnsRobertJ/status/327571569280970752,0,0
4/26/13 19:55,DONT FORGET TOMORROW @ 11am @The Country Inn & Suites (next to Pets Mart behind Barnes and Noble) hope to see you... http://fb.me/2qPhfLRGy,RebeccaF18,3.27934E+17,https://twitter.com/RebeccaF18/status/327934060343201792,0,0
4/27/13 19:33,Pool time! (@Country Inn & Suites - @ countryinns) http://4sq.com/YcVeRS,HomebrewPort,3.28291E+17,https://twitter.com/HomebrewPort/status/328290725504634880,0,0
4/28/13 19:51,Welcome to holders Country Inn I take your order Vannah Leigh,Carlosmrtnz898,3.28658E+17,https://twitter.com/Carlosmrtnz898/status/328657750265585664,0,0
4/30/13 19:58,TOMORROW NIGHT!!! Ashton Hollow will be rocking Armor Inn Tap Room for Country 106.5 WYRK Country night!!! so come... http://fb.me/KDxcqqcD,Crrazyjill,3.29384E+17,https://twitter.com/Crrazyjill/status/329384268474245120,0,0
5/1/13 19:58,"I'm at 旅の宿 towadako inn Country Road (十和田市, 青森県) http://4sq.com/ZXiqUa",ajmaq,3.29747E+17,https://twitter.com/ajmaq/status/329746700518436864,0,0
5/2/13 19:35,Comfort Inn Amish Country : USD 110 http://datravelapp.com/display_hotel_deal.php?hoteldealid=49336 … # TheCheappassess # datravelapp,alirizvi1770,3.30103E+17,https://twitter.com/alirizvi1770/status/330103374336892928,0,0
5/3/13 19:31,Only at the Country Inn bar would Golden Girls be playing on the TV. # Classic,brookeprather33,3.30465E+17,https://twitter.com/brookeprather33/status/330464715706867712,0,0
5/4/13 19:47,# snuggles # corgi # welshcorgi # fluffycorgi # love # loverboy # dog @Country Inn http://instagram.com/p/Y6KOphqZHz/,goldielocksrox,3.30831E+17,https://twitter.com/goldielocksrox/status/330831068137656320,0,0
5/5/13 19:06,Cake in a mug! Fun! @Genesee Country Inn Bed & Breakfast http://instagram.com/p/Y8qgGrs9wc/,YankeeInnkeeper,3.31183E+17,https://twitter.com/YankeeInnkeeper/status/331183207531810816,0,0
5/6/13 18:58,"Diamond Dolls “Lucky Green” Pageant: Country Inn & Suites 13501 Memorial Park Drive Oklahoma City, OK, Oklahoma City http://dlvr.it/3L0vDQ",OklaCityEvents,3.31543E+17,https://twitter.com/OklaCityEvents/status/331543469279547392,0,0
5/7/13 18:43,Night Audit (Country Inn and Suites ) http://dlvr.it/3LGWvq,Harrisbrg_Jobs,3.31902E+17,https://twitter.com/Harrisbrg_Jobs/status/331902144196255744,0,0
5/8/13 19:44,"I'm at Country Inn & Suites By Carlson, York, PA - @ countryinns (York, PA) [pic]: http://4sq.com/12X1RUD",MikeInBmore,3.3228E+17,https://twitter.com/MikeInBmore/status/332279833440710656,0,0
5/9/13 19:54,Holy shit the guy who owns all burger kings in ri owns all newport creamerys and the country inn in warren....,JustinUrsini,3.32645E+17,https://twitter.com/JustinUrsini/status/332644728275341313,0,0
5/10/13 19:32,Country inn with momma.,_bayleephillips,3.33002E+17,https://twitter.com/_bayleephillips/status/333001621216849921,0,0
5/11/13 19:48,"World of Bluegrass 2013 • The Mast Farm Inn, Historic Country Inn • http://buff.ly/10pbdqB",MastFarm,3.33368E+17,https://twitter.com/MastFarm/status/333367937018777600,0,1
5/12/13 19:48,"Elopements, Revival Photography | The Mast Farm Inn, Historic Country Inn | http://buff.ly/120EHxs",MastFarm,3.3373E+17,https://twitter.com/MastFarm/status/333730331217768450,0,0
5/13/13 19:41,"The Loyalist Country Inn, a Lakeview Resort : USD 99 http://datravelapp.com/hot-deals-on-hotels.php … # TheCheappassess # datravelapp",alanburke20101,3.34091E+17,https://twitter.com/alanburke20101/status/334091092519702528,0,0
5/14/13 19:39,Anybody If you wanna chill come to the hot tub at country inn and suites.,JohnGillette23,3.34453E+17,https://twitter.com/JohnGillette23/status/334452931044704257,0,0
5/15/13 19:30,COUNTRY HEARTH INN EAU CLAIRE : USD 0 http://datravelapp.com/hot-deals-on-hotels.php … # TheCheappassess # datravelapp,marshallash,3.34813E+17,https://twitter.com/marshallash/status/334813026718986241,0,0
5/16/13 19:38,With Keira & Felicia :) Virginia Beach! (@Country Inn & Suites - @ countryinns) http://4sq.com/19ASNIM,tweetheart_ox,3.35177E+17,https://twitter.com/tweetheart_ox/status/335177389032222721,0,0
5/17/13 19:52,@vmanzo20 @ crabtreejake1 I'm at the country inn,zayyyydel,3.35543E+17,https://twitter.com/zayyyydel/status/335543382900359168,0,0
5/18/13 19:45,the american music country count down with jacob sexton is coming up at the top of the hour. filling inn for Eric tyler,MushroomFM,3.35904E+17,https://twitter.com/MushroomFM/status/335903956058374144,2,0
5/19/13 19:58,"I'm at Country Inn & Suites - @ countryinns (West Seneca, NY) http://4sq.com/11PW8WI",DA1UDREAMBOUT69,3.3627E+17,https://twitter.com/DA1UDREAMBOUT69/status/336269623513198592,0,0
5/20/13 19:57,Country Inn with my brothers. # Yummyummyummmm,nicolediangg,3.36632E+17,https://twitter.com/nicolediangg/status/336631877676961792,0,1
5/21/13 18:44,Visiting # Peoria (Illinois) this summer? Stay in Country Inn & Suites North Peoria (Illinois): http://hotelcrow.com/Deal/145577/Country_Inn_Suites_North_Peoria_Illinois …,HotelCrow,3.36976E+17,https://twitter.com/HotelCrow/status/336975772285808640,0,0
5/22/13 19:57,Room 338 is where is at! @Country Inn & Suites By Carlson Breakfast Room http://instagram.com/p/Zohv8HTgWh/,marialfc,3.37357E+17,https://twitter.com/marialfc/status/337356644604313600,0,0
5/23/13 19:58,Coolin' ;) =D # Selfie # Me # Coolin # SnappinPics # Burton # SouthCarolina # CountryInn # YouAlreadyKnow =D… http://instagram.com/p/Zq9S6GNlHB/,DEEZY_201,3.37719E+17,https://twitter.com/DEEZY_201/status/337719239374938112,0,0
5/24/13 19:55,Country Inn Suites Savannah Airport http://is.gd/P57jBN,placeinsavannah,3.38081E+17,https://twitter.com/placeinsavannah/status/338080729797898240,0,0
5/25/13 19:56,"I'm at Holder's Country Inn (San Jose, CA) http://4sq.com/178chbE",RogueEnterprise,3.38444E+17,https://twitter.com/RogueEnterprise/status/338443528533315586,0,0
5/26/13 19:59,"""@jbreezy0285: @ ESkiBBM When is the baby shower?""-- It's Sunday at 5pm at Country Inn & Suites Historic District, tell your mom also.",ESkiBBM,3.38807E+17,https://twitter.com/ESkiBBM/status/338806621926989824,0,0
5/27/13 19:13,"Just posted a photo @Country Inn & Suites By Carlson, Atlanta At Buckhead, GA http://instagram.com/p/Z1UwirKfrs/",Mystery_0111,3.39157E+17,https://twitter.com/Mystery_0111/status/339157417893953536,0,0
5/28/13 19:19,Got an interview for country inn tomorrow...YES,eddywardchan,3.39521E+17,https://twitter.com/eddywardchan/status/339521434701398016,0,2
5/31/13 19:42,Deep in the heart of tourist country. (@Clarion Inn Historic Strasburg Inn) http://4sq.com/15lSIIU,TRezendes,3.40614E+17,https://twitter.com/TRezendes/status/340614285686345728,0,0
6/1/13 19:52,"Genuinely never wanted to leave The Belfray Country Inn, Derry. The staff were SO lovely. And the owner used to run a nightclub on Guernsey!",mariel__t,3.40979E+17,https://twitter.com/mariel__t/status/340979109742125057,0,0
6/2/13 19:36,Country Inn & Suites By Carlson West Valley City : USD 89 http://datravelapp.com/hot-deals-on-hotels.php?dealid=97263 … # TheCheappassess # datravelapp,kim_clarklee,3.41338E+17,https://twitter.com/kim_clarklee/status/341337632489472000,0,0
6/3/13 19:55,@ clubcarlson all around technology fail @Berea KY Country Inn tonite,AmyArtisan,3.41705E+17,https://twitter.com/AmyArtisan/status/341704638845841408,0,0
6/4/13 19:08,“ @ blackenterprise: Fairfield Inn & Suites by Marriott ELEVATES Female Entrepreneurs Across The Country http://dlvr.it/3T0zkD ”,ajthigpen0321,3.42055E+17,https://twitter.com/ajthigpen0321/status/342055237688893440,0,0
6/5/13 19:56,@ kimberlyann7903 Hey! @ sissi_massie & I got our hotel! We are staying at the Country Inn Suites in Newnan... Is that a good area?,_jenniferjjames,3.4243E+17,https://twitter.com/_jenniferjjames/status/342429693796036609,0,1
6/6/13 19:24,Country Inn & Suites By Carlson Savannah Midtown GA http://is.gd/nhNUIN,placeinsavannah,3.42784E+17,https://twitter.com/placeinsavannah/status/342784019332730880,0,0
6/7/13 19:42,"Country Inn & Suites By Carlson, Port Charlotte, FL : USD 84 http://datravelapp.com/hot-deals-on-hotels.php?dealid=5741 … # TheCheappassess # datravelapp",MarkS62904919,3.43151E+17,https://twitter.com/MarkS62904919/status/343150980797431808,0,0
6/8/13 19:51,"I'm going to get the Warrior Burger because I feel like a Warrior"" # stufflisanelsensayz at the Country Drive Inn",nelses1,3.43516E+17,https://twitter.com/nelses1/status/343515540259741697,0,1
6/9/13 19:31,Country Hearth Inn Wharton : USD 55 http://datravelapp.com/hot-deals-on-hotels.php?dealid=10757 … # TheCheappassess # datravelapp,williamchin90,3.43873E+17,https://twitter.com/williamchin90/status/343873022169587713,0,0
6/10/13 19:59,the music at village inn ranges from shitty 80's music to shitty country music to Justin bieber I'm laughing,melaniedamn,3.44242E+17,https://twitter.com/melaniedamn/status/344242380557414400,0,0
6/11/13 19:35,with Scott (@Country Inn & Suites) http://4sq.com/12Ei9YN,JaneShank,3.44599E+17,https://twitter.com/JaneShank/status/344598865120485376,0,0
6/12/13 19:59,Vacation out of town at Country inn & suite party. # RidFreeOnMe,BOSSMANPRE,3.44967E+17,https://twitter.com/BOSSMANPRE/status/344967337423822849,0,0
6/13/13 19:41,"Welcome, race fans (@Country Inn & Suites By Carlson, Dundee, MI - @ countryinns) http://4sq.com/ZMT2zc",MelSaidThat,3.45325E+17,https://twitter.com/MelSaidThat/status/345325120727961600,0,0
6/14/13 19:55,"The Delta Town & Country Inn is hosting a Father's Day Brunch with a BBQ twist! Sunday, June 16 10am-2pm: http://bit.ly/1766GTA",VisitRichmondBC,3.45691E+17,https://twitter.com/VisitRichmondBC/status/345691025509085184,0,0
6/15/13 19:12,"Seafood in the boonies. @Country Inn in Parsons, W.Va with @ leah_pepitapic.twitter.com/5lxi7CTpJm",caramrich,3.46043E+17,https://twitter.com/caramrich/status/346042670449315840,1,0
6/16/13 19:30,New Job!: Head Chef - Dorset Country Inn http://bit.ly/17eMajI,JobSeeker_USA,3.4641E+17,https://twitter.com/JobSeeker_USA/status/346409519896748033,0,0
6/17/13 19:38,Look what I found on @ eBay! http://r.ebay.com/JXVBNd Home Interiors Sunny Yellow Creamer Sugar Set Retired Country Inn,BUCKEYE_SMILES,3.46774E+17,https://twitter.com/BUCKEYE_SMILES/status/346773884114178048,0,0
6/18/13 19:58,with @ dahldahl8 (@Country Inn & Suites By Carlson - @ countryinns) http://4sq.com/1aqHq9o,TheNic1,3.47141E+17,https://twitter.com/TheNic1/status/347141354868047872,0,0
6/19/13 19:24,"I'm at Josef's Country Inn (Fallston, MD) http://4sq.com/11MRnGr",JohnZiemblicki,3.47495E+17,https://twitter.com/JohnZiemblicki/status/347495042916700160,0,0
6/20/13 19:39,"Panamá ;) (@Country Inn & Suites By Carlson, Panama - @ countryinns) http://4sq.com/11PXARX",anachiodi_,3.47861E+17,https://twitter.com/anachiodi_/status/347861387567058944,0,0
6/21/13 19:53,"Weekend away begins! (@Country Inn & Suites By Carlson, Galesburg, IL - @ countryinns) http://4sq.com/184sQ8p",Tuttutt,3.48227E+17,https://twitter.com/Tuttutt/status/348227212346007553,0,0
6/22/13 19:58,# SampleSaturday @ joycedebacco SERENDIPITY HOUSE http://bit.ly/riN7tw # Romance # Mystery Mother-Daughter Issues at rundown country inn.,DWoolAuthor,3.48591E+17,https://twitter.com/DWoolAuthor/status/348590774386057216,0,0
6/23/13 19:55,# SampleSaturday @ joycedebacco SERENDIPITY HOUSE http://bit.ly/riN7tw # Romance # Mystery Mother-Daughter Issues at rundown country inn.,WayneLMurphy,3.48952E+17,https://twitter.com/WayneLMurphy/status/348952427929677824,0,0
6/24/13 19:49,Eating Caesar Salad with Chopped-sticks. @Country Inn & Suites By Carlson-San Antonio Airport http://instagram.com/p/a9fFuNi7hq/,AlfonsoFuentes1,3.49313E+17,https://twitter.com/AlfonsoFuentes1/status/349313301148205056,0,0
6/25/13 19:58,No way country inn and suites cottage grove...u can't fool me :) http://instagram.com/p/bAE_D2qwAb/,bobbydhines,3.49678E+17,https://twitter.com/bobbydhines/status/349678105302020097,0,0
6/26/13 19:54,Who else is at the country inn,ChrisHaimbaugh1,3.50039E+17,https://twitter.com/ChrisHaimbaugh1/status/350039439248076800,0,1
6/27/13 19:55,@ KendalRoberts1 I would but I really like my new job. You still working at country inn?,amy_gagen,3.50402E+17,https://twitter.com/amy_gagen/status/350402032634572803,0,0
6/28/13 19:32,"I'm at Country Inn & Suites By Carlson, Beckley, WV - @ countryinns (Beckley, WV) http://4sq.com/1cwNkE8",Shoelaceyy,3.50759E+17,https://twitter.com/Shoelaceyy/status/350758661209092096,0,0
6/30/13 19:55,"I'm at Best Western Rainbow Country Inn - @ bwrci (Chilliwack, BC) http://4sq.com/13gkLwx",parkspix,3.51489E+17,https://twitter.com/parkspix/status/351489309037182976,0,0
7/1/13 19:45,This is going to be one long ass night! # countryInn # bored,aleashakimmes,3.51849E+17,https://twitter.com/aleashakimmes/status/351849158136700929,0,0
7/2/13 19:41,Dinner with the people (@Fieldstone Country Inn) http://4sq.com/15exQ7c,wildbrat66,3.5221E+17,https://twitter.com/wildbrat66/status/352210332216872960,0,0
7/3/13 19:56,California Wine Country: Garden to Glass Summer Events at Kenwood Inn and Spa http://goo.gl/TFtkA via @ themomjen,WanderingEds,3.52577E+17,https://twitter.com/WanderingEds/status/352576507031453697,0,0
7/4/13 19:56,"I'm at Country Inn & Suites - @ countryinns (Orlando, FL) http://4sq.com/1aHCJd6",gii_tamer,3.52939E+17,https://twitter.com/gii_tamer/status/352938947149692929,0,0
7/5/13 19:52,"I'm at Seminole Country Inn (Indiantown, FL) http://4sq.com/1aL3hu5",scottduncan2010,3.533E+17,https://twitter.com/scottduncan2010/status/353300295104741377,0,0
7/6/13 19:58,"I'm at Country Inn & Suites By Carlson, Tinley Park, IL - @ countryinns (Tinley Park, IL) http://4sq.com/14yPj9J",Jman2419,3.53664E+17,https://twitter.com/Jman2419/status/353664176650059777,0,0
7/7/13 19:19,"Find available rooms at Country Inn & Suites By Carlson, Helen, GA http://www.countryinns.com/helen-hotel-ga-30545/gahelen …",CountryInnHelen,3.54017E+17,https://twitter.com/CountryInnHelen/status/354016852705419267,0,0
7/8/13 19:58,@ BigScaryMexican Country Inn South,gomezw05,3.54389E+17,https://twitter.com/gomezw05/status/354389172548677634,0,0
7/9/13 19:59,"I'm at Country Inn & Suites By Carlson, Cool Springs, TN - @ countryinns (Franklin, TN) http://4sq.com/1amEOvE",BigMikeHix,3.54752E+17,https://twitter.com/BigMikeHix/status/354751616055910400,0,0
7/10/13 19:51,"I'm at Country Inn & Suites - @ countryinns (Cape Canaveral, FL) http://4sq.com/15gIGrd",kickrunnamaste,3.55112E+17,https://twitter.com/kickrunnamaste/status/355112020254801920,0,0
7/11/13 19:29,I love lamp. @Country Motor Inn http://instagram.com/p/bpOWt5FC2e/,hogleg,3.55469E+17,https://twitter.com/hogleg/status/355468907634638849,0,0
7/12/13 19:29,@ autt_marie country inn,asimmers_3,3.55831E+17,https://twitter.com/asimmers_3/status/355831292002181122,0,0
7/13/13 19:57,Typical for our air con to not work in a premier inn with 600 rooms in the hottest part of the country on the hottest day of the year,HannahShep96,3.56201E+17,https://twitter.com/HannahShep96/status/356200644245336065,0,0
7/14/13 19:22,"We had a great morning today at David's Country Inn with beautiful bride, Amanda! She looked breathtaking! (Hair... http://fb.me/21z7HGSRd",westsidehairnj,3.56554E+17,https://twitter.com/westsidehairnj/status/356554312110981120,0,0
7/15/13 19:47,@ JAThomp33 @ thinkblind7 @ hirschj13 don't think it's finished yet. Not many rooms left but we are at country inn & suites. It isn't too bad,BryceTeater,3.56923E+17,https://twitter.com/BryceTeater/status/356923034633895936,0,0
7/16/13 19:45,"I'm at Country Inn & Suites By Carlson, Columbus-Airport East, OH - @ countryinns (Columbus, OH) http://4sq.com/18mkZUN",richlilly,3.57285E+17,https://twitter.com/richlilly/status/357284933896658944,0,0
7/17/13 19:55,"Stay at Grand Country Inn in Branson, MO: http://j.mp/12vCBFD < now it's on!",TulsaPlaces,3.5765E+17,https://twitter.com/TulsaPlaces/status/357649841687494656,0,0
7/18/13 19:59,Welcome to our latest Official Partner - Otematata Country Inn! Here's some more info: Otematata Country Inn... http://fb.me/2LAxKxHIe,Alps2Ocean,3.58013E+17,https://twitter.com/Alps2Ocean/status/358013152165761024,0,0
7/19/13 19:59,En un nuevo hotel country Inn & suites,cesarx__x3,3.58376E+17,https://twitter.com/cesarx__x3/status/358375684990697473,0,1
7/20/13 18:17,"@ _Major_Moves_ da crib, we doin dat shit again tonight @country inn",_YungFedi,3.58712E+17,https://twitter.com/_YungFedi/status/358712293875396609,0,0
7/21/13 19:47,@ ThaDarkSkinnOne Right Across From The School Next To Fridays.. The Country Inn & Suites,xoNuu,3.59097E+17,https://twitter.com/xoNuu/status/359097401719529473,0,0
7/23/13 19:56,Call and ask about our special rate for the run! http://fb.me/Mo94AJLT,CountryInn_SCMN,3.59824E+17,https://twitter.com/CountryInn_SCMN/status/359824327354494976,0,0
7/24/13 19:43,Hoy realizando ejercicios al aire libre..!!! @Country Inn Amador http://instagram.com/p/cKuO7gNqeU/,lordalgra,3.60184E+17,https://twitter.com/lordalgra/status/360183551943122944,0,0
7/25/13 19:31,Shannon M.'s Review of PASO ROBLES WINE COUNTRY INN - Paso Robles (1/5) http://dlvr.it/3jLRJL,bubblegumalleys,3.60543E+17,https://twitter.com/bubblegumalleys/status/360542749516238849,0,0
7/26/13 19:45,DANCING WITH THE BARS ALL STARS CONTESTANT #5: KAT CARLSON! Cash Inn Country favorite- the lovely &... http://fb.me/1VOLwUZxQ,ionarizona,3.60909E+17,https://twitter.com/ionarizona/status/360908651835305985,0,0
7/27/13 19:32,Jackalope country ... # jackalope # jackalopecountry # douglas # wyoming # homeofthejackalope @College inn http://instagram.com/p/cSbVlQhIUs/,ironskystudio,3.61268E+17,https://twitter.com/ironskystudio/status/361267848036884480,0,0
7/28/13 19:24,Jeremiah's Restaurant on # Yelp: I am staying at the Best Western Country Inn which surrounds this restuarant and ve… http://www.yelp.com/biz/jeremiahs-restaurant-ogden?pt=review&ref=twitter&v=3#hrid:CyDCDp2iGc5i9ZZE3oNGWg …,BigButch52,3.61628E+17,https://twitter.com/BigButch52/status/361628369604984832,0,0
7/31/13 19:50,# SampleSaturday @ joycedebacco SERENDIPITY HOUSE http://bit.ly/riN7tw # Romance # Mystery Mother-Daughter Issues at rundown country inn.,JNaomiAy,3.62722E+17,https://twitter.com/JNaomiAy/status/362722046926520321,0,0
8/1/13 19:59,"I'm at Country Inn & Suites By Carlson, York, PA - @ countryinns (York, PA) http://4sq.com/1bQ1rJE",JasonRC13,3.63087E+17,https://twitter.com/JasonRC13/status/363086647711105025,0,0
8/2/13 19:50,Ckeckin in for the night before Air Venture in the morning (@Country Inn & Suites by Carlson-Fond Du Lac) on # Yelp http://www.yelp.com/biz/country-inn-and-suites-by-carlson-fond-du-lac-fond-du-lac?pt=check_in&ref=twitter&v=4b …,aeromac,3.63447E+17,https://twitter.com/aeromac/status/363446658614312960,0,0
8/3/13 19:55,"Please Don't book a hotel room at the Country Inn hotel & suites in College Park,GA. This hotel is Fucked up and rude as hell.",PaigeThePlug,3.6381E+17,https://twitter.com/PaigeThePlug/status/363810476100026369,0,0
8/4/13 19:58,@ blu_eyes_cry u too ill come when inn my country will be 15:00 pm niw in my country 05:58am,_mramor_,3.64174E+17,https://twitter.com/_mramor_/status/364173527366533120,0,0
8/5/13 19:49,The view from the Country Inn Suites in Amador http://fb.me/LZOrsAZ5,PmaCityTravel,3.64534E+17,https://twitter.com/PmaCityTravel/status/364533690032214016,0,0
8/6/13 19:54,@ sportsyenta I'm leaving tomorrow so have breakfast at Country Inn and leave for airport back to Florida by 11.,ConnieScouts,3.64897E+17,https://twitter.com/ConnieScouts/status/364897240319410176,0,0
8/7/13 19:15,"Enter to win a 3 night stay with Country Inn and Suites plus $3,000!! http://bit.ly/1aieFOG Good luck! - Admin... http://fb.me/3fbkpAo6k",SCCC5,3.6525E+17,https://twitter.com/SCCC5/status/365249932346654722,0,0
8/8/13 19:49,@ BenLondon1 country inn and suites,miron7SPkidd,3.65621E+17,https://twitter.com/miron7SPkidd/status/365620779129376770,0,0
8/10/13 19:56,"Made it to Burnsville, N.C. Staying at Carolina Country Inn.... sharing in the a.m. at Faith Fellowship Church!",jjmather,3.66347E+17,https://twitter.com/jjmather/status/366347282481811457,0,1
8/11/13 19:24,Chegamos @Country Inn & Suites http://instagram.com/p/c5CXAeshWo/,mcampello,3.66702E+17,https://twitter.com/mcampello/status/366701592868700160,0,0
8/12/13 19:39,Country Inn Meals to Remember: Based on the Pbs-TV Series More Country Inn Cooking With Gail Greco book download http://twitpic.com/d7z2y2,AimeeIbba,3.67068E+17,https://twitter.com/AimeeIbba/status/367067763140866048,0,0
8/13/13 19:45,Book an exciting end-of-year vacation to India with the Hot Deals # offer and save up to 30% at participating hotels: http://ow.ly/nTu7h,countryinn,3.67432E+17,https://twitter.com/countryinn/status/367431770700263424,1,0
8/14/13 19:53,"Let's see...this weekend Wings Over Wine Country air show, then Bodega Seafood Art & Wine Festival next weekend... http://fb.me/yvOz1db4",Farmhouse_Inn,3.67796E+17,https://twitter.com/Farmhouse_Inn/status/367796055275888640,1,0
8/15/13 19:20,"I'm at Country Inn & Suites By Carlson - @ countryinns (Warner Robins, GA)http://4sq.com/1eNpBAT",signboy78,3.6815E+17,https://twitter.com/signboy78/status/368150322709299200,0,0
8/16/13 19:33,@ OGTurt954 la quinta lol ...n there was this other one called country inn suites,SheedSantana,3.68516E+17,https://twitter.com/SheedSantana/status/368515856579317761,0,0
8/17/13 19:59,Dinner time! (@Wine Country Inn) http://4sq.com/149erFn,jim_mcfarland,3.68885E+17,https://twitter.com/jim_mcfarland/status/368884736099229696,0,0
8/18/13 19:53,"I'm at Country Inn & Suites By Carlson - @ countryinns (Harrisburg, PA) http://4sq.com/16ValPL",toddkehley,3.69246E+17,https://twitter.com/toddkehley/status/369245679324901376,0,0
8/19/13 19:32,"At Quality Inn # Winkler, breakfast is served all day long at the on-site Country Kitchen – where lunch… http://instagram.com/p/dNpx5yuixG/",DaysInnStbh,3.69603E+17,https://twitter.com/DaysInnStbh/status/369602913213378560,0,0
8/20/13 19:21,@ demo_ken @ copax I checked out hotels also...There's a Country Inn for about $95 a night in October. Let's do it. What dates work?,KabrtZinsli,3.69962E+17,https://twitter.com/KabrtZinsli/status/369962409114337282,0,0
8/21/13 19:59,Staying the night. Tomorrows the big day:D Can't wait!!!!! (@Country Inn & Suites - @ countryinns) http://4sq.com/184vmX1,mmasher101,3.70334E+17,https://twitter.com/mmasher101/status/370334290825183232,0,0
8/22/13 19:59,"Hanging out! (@Country Inn & Suites By Carlson, Big Flats, NY - @ countryinns) http://4sq.com/18NhUJs",Metalheadbetty,3.70697E+17,https://twitter.com/Metalheadbetty/status/370696818562437120,0,0
