Date,Text,Username,Id,Permalink,Retweets,Favorites
12/20/10 18:26,ஜ # Austin # TX The Time Lapse of Oregon Wine Country's Allison Inn & Spa in Newberg in Willamette Valley http://bit.ly/iiVNom,TexasAustin,1.69979E+16,https://twitter.com/TexasAustin/status/16997876102070272,0,0
12/21/10 18:00,Christmas holiday in the White Mountains. This B&B has treated us well so far. (@Wyatt House Country Inn) http://4sq.com/hxbm3e,JoePolitic,1.73538E+16,https://twitter.com/JoePolitic/status/17353757230628864,0,0
12/22/10 18:55,@N1ckChiocchio Country Inn Chicken Parm >>>>,julianmoran25,1.773E+16,https://twitter.com/julianmoran25/status/17729981685698560,0,0
12/23/10 18:56,"I'm at Cliffs Country Inn (34-70 New York 9P, Malta) w/ 4 others http://4sq.com/gswGam",tdphillipsjr,1.80927E+16,https://twitter.com/tdphillipsjr/status/18092691086639104,0,0
12/24/10 18:33,"I'm at Victoria Country Inn (1604 Quintard Ave, Anniston) http://4sq.com/ev3CP7",DonCrow,1.84493E+16,https://twitter.com/DonCrow/status/18449256285216768,0,0
12/25/10 18:50,"Country Inn & Suites By Carlson, New Orleans French Quarter, New ... http://bit.ly/9LMyX9",extendedstay001,1.88159E+16,https://twitter.com/extendedstay001/status/18815892833964032,0,0
12/26/10 18:51,"If you're anywhere near the Country Hearth Inn in Galloway Twp, NJ; come on over! PAR-TAY!!!",stalegum,1.91786E+16,https://twitter.com/stalegum/status/19178594697740288,0,0
12/27/10 18:47,"Clinical Manager - Satellite Healthcare - Austin, TX: We're Satellite Healthcare, one of the country's most inn... http://bit.ly/hlVGkA",NewAustinJobs,1.954E+16,https://twitter.com/NewAustinJobs/status/19539986713939968,0,0
12/28/10 18:32,@LiickMiiDowN country inn and the have free internet pool jacuzzi free continental breakfast,JuiCybella,1.98985E+16,https://twitter.com/JuiCybella/status/19898461855944705,0,0
12/31/10 18:56,Spending some quality time with the immediate and extended family (@Country Inn Woodbury) http://4sq.com/i5AZEr,cyberhomie,2.09918E+16,https://twitter.com/cyberhomie/status/20991773039927296,0,0
1/1/11 18:38,I'm at Country Inn (Via monte stella) http://4sq.com/fgrCBD,davespace,2.13495E+16,https://twitter.com/davespace/status/21349474697748480,0,0
1/2/11 18:14,"$499 4/nght Tremblent, Canada 4 star Country Inn & Suites & 3 day lift ticket Book by 01/31 # travel # vacation Ask me how!",TravelRoos,2.17059E+16,https://twitter.com/TravelRoos/status/21705934527008768,0,0
1/4/11 18:59,"My girl @ kels_michelle is hooked on Jackson's, Big Apple Inn. Somebody gonna have a big country booty soon lol",DrJSapio,2.24421E+16,https://twitter.com/DrJSapio/status/22442056118960128,0,0
1/5/11 18:41,@ sarahbeth2012. Country inn and suites I think! Y'all?,SaraKLynch,2.28E+16,https://twitter.com/SaraKLynch/status/22799957530509313,0,0
1/6/11 18:52,"Made it!!!! (@Country Inn & Suites By Carlson, Gurnee) http://4sq.com/g8bi9d",dUNKato,2.31652E+16,https://twitter.com/dUNKato/status/23165152073355264,0,0
1/7/11 18:50,"Country Inn & Suites By Carlson, New Orleans French Quarter, New Orleans - Book now and save! http://tinyurl.com/22nr6y2",ean_agentrez,2.35269E+16,https://twitter.com/ean_agentrez/status/23526889318522881,0,0
1/8/11 18:35,"I'm at Country Inn of Two Harbors (1204 7th ave, Two Harbors) http://4sq.com/dSkz8a",jasonwittich,2.38856E+16,https://twitter.com/jasonwittich/status/23885568588910592,0,0
1/9/11 18:09,$199 Inn at Occidental of Sonoma Wine Country # craigslist # realestate # vacationproperties # SFO http://3taps.com/w/5XWJD5,SFO_VacationRE,2.42415E+16,https://twitter.com/SFO_VacationRE/status/24241484156903425,0,0
1/10/11 18:38,"""LIKE"" the Historic Stone House Restaurant and Country Inn Facebook page and check out the Discount Certificate... http://fb.me/Q1a0Iyq9",RonLovelace,2.4611E+16,https://twitter.com/RonLovelace/status/24610957829341184,0,0
1/12/11 18:32,"Country Inn & Suites By Carlson, New Orleans French Quarter, New Orleans - Sale! Save 30% on this Stay. http://tinyurl.com/4utm9zg",ean_agentrez,2.53342E+16,https://twitter.com/ean_agentrez/status/25334214845014016,0,0
1/14/11 18:34,"Country Inn & Suites Hotel in Manassas, VA Unveils New Website: ... high-speed Internet in addition to its locat... http://bit.ly/h4b4fj",OrganicLoudoun,2.60597E+16,https://twitter.com/OrganicLoudoun/status/26059665649442816,0,0
1/15/11 18:35,"Country Inn & Suites By Carlson, New Orleans French Quarter, New Orleans - Sale! Save 30% on this Stay. http://tinyurl.com/4c34zf8",ean_agentrez,2.64221E+16,https://twitter.com/ean_agentrez/status/26422130878976000,0,0
1/16/11 18:57,"At Country Pizza Inn w @ followrusty ordered yummy calzone, pizza, greek salad :) http://twitpic.com/3qq6fn",CateTV,2.67901E+16,https://twitter.com/CateTV/status/26790144732303360,0,0
1/17/11 18:46,"Northside Christian Church Sunday, February 6 9:30am-2:00pm Location Country Inn 4500 Lakeland Park Dr Lakeland, FL http://twitvid.com/1AOGH",GOD_N_YOU,2.71498E+16,https://twitter.com/GOD_N_YOU/status/27149817360678912,0,0
1/18/11 18:53,Man this hotel sucks! DO NOT STAY HERE! (@country inn and suites) http://4sq.com/fsFJmK,suthrn1,2.7514E+16,https://twitter.com/suthrn1/status/27514024396587008,0,0
1/19/11 18:14,I'm at Country Inn & Suites w/ @ kennemca http://4sq.com/haNRJz,XinaK,2.78664E+16,https://twitter.com/XinaK/status/27866396541059072,0,0
1/20/11 18:21,"I'm at Country Inn & Suites By Carlson, Cuyahoga Falls (1420 Main St, Cuyahoga Falls) http://4sq.com/ejlLIk",erfarrell00,2.82308E+16,https://twitter.com/erfarrell00/status/28230766362103809,0,0
1/21/11 18:50,Have a happy weekend! We'll be out at Cash Inn on Sunday for their Country Idol Preliminary! See you there!,swayevents,2.86002E+16,https://twitter.com/swayevents/status/28600227174817792,0,0
1/22/11 18:57,"I'm at Country Inn & Suites Portage (1630 Olmsted Drive, Portage) http://4sq.com/eEID72",Heather_Kapica,2.89644E+16,https://twitter.com/Heather_Kapica/status/28964400253636608,0,0
1/23/11 18:18,"Country Inn & Suites By Carlson, New Orleans French Quarter, New Orleans - Sale! Save 30% on this Stay. http://tinyurl.com/4rpx2j3",ean_agentrez,2.93171E+16,https://twitter.com/ean_agentrez/status/29317050119757824,0,0
1/24/11 18:53,"Congratulations to Trisha and T., who will be representing Cash Inn at the Country Idol Finale! Next up, we'll be... http://fb.me/E3Y7qggp",swayevents,2.96882E+16,https://twitter.com/swayevents/status/29688230626463745,0,0
1/25/11 18:40,Culvers then kyles with the boyss for the night. Hittin up country inn in the morn. then camp :),Adrionic3000,3.00475E+16,https://twitter.com/Adrionic3000/status/30047489889411073,0,0
1/26/11 18:48,I'm at Country Inn and Suites (Westmorland County) http://4sq.com/g8YMVt,Fitzington,3.04119E+16,https://twitter.com/Fitzington/status/30411866907877376,0,0
1/27/11 17:51,"I'm at Country Inn and Suites (6305 E. Broad St., Columbus) http://4sq.com/hqAntF",Nequick,3.07599E+16,https://twitter.com/Nequick/status/30759855681708032,0,0
1/28/11 18:20,"Part Time Front Desk Agent (sunnyvale): Country Inn & Suites - Sunnyvale, an award-winning select service hotel ... http://bit.ly/hakCSR",softwareobjects,3.11296E+16,https://twitter.com/softwareobjects/status/31129606270488578,0,0
1/31/11 18:53,@ ZackAshkenazi country inn suites,rubsaka,3.22251E+16,https://twitter.com/rubsaka/status/32225067546968064,0,0
2/1/11 18:38,HAXTON MANOR in Salt Lake City is a unique English Country Inn. clear http://womlasvegas.com/j.php?r=16&c=Salt_Lake_City_Utah&s=5481&i=11278&zz=737 …,womcalcutta,3.25837E+16,https://twitter.com/womcalcutta/status/32583651212402688,0,0
2/2/11 18:11,HAXTON MANOR in Salt Lake City is a unique English Country Inn. adorable http://vegasvirtualconvention.com/j.php?r=16&c=Salt_Lake_City_Utah&s=5481&i=&zz=457 …,sfrldy,3.29392E+16,https://twitter.com/sfrldy/status/32939177205047296,0,0
2/3/11 18:47,SASKATCHEWAN - Food and Beverage Server needed at Country Squire Inn check out Tourism job board on www2.capilanou.ca/ses for more info!,CapUCDC,3.33106E+16,https://twitter.com/CapUCDC/status/33310555796144128,0,0
2/4/11 18:41,Emily Buck's Director is tonight at 7pm at the Country Inn & Suites in Mankato. Special guests NSD Sharon Buck and... http://fb.me/P9ZWW7WW,starrmackenzie,3.36714E+16,https://twitter.com/starrmackenzie/status/33671419653001216,0,0
2/5/11 18:58,"Country Inn & Suites By Carlson, New Orleans French Quarter, New Orleans - Book now and save! (on select nights) http://tinyurl.com/4rblvll",ean_agentrez,3.40382E+16,https://twitter.com/ean_agentrez/status/34038158249168896,0,0
2/6/11 18:46,Country Inn Stes Sycamore Sycamore http://reservation.travelaffiliatepro.com/hotel/details/CX7055,TraAffiliatePro,3.43974E+16,https://twitter.com/TraAffiliatePro/status/34397440601755648,0,0
2/7/11 18:50,Looking for plans for Valentine's Day still? Romance your sweetheart at the Wine Country Inn this year!,WineCountryInn,3.4761E+16,https://twitter.com/WineCountryInn/status/34761018349461504,0,0
2/8/11 18:47,Country Inn Decorah Decorah http://reservation.travelaffiliatepro.com/hotel/details/CX815,TraAffiliatePro,3.51226E+16,https://twitter.com/TraAffiliatePro/status/35122586530611201,0,0
2/9/11 18:41,Oregon Country Trails event planning meeting is at The Pfeiffer Cottage Inn today at 4pm. Planning more ways you... http://fb.me/UcYlYQGb,debinpdx,3.54834E+16,https://twitter.com/debinpdx/status/35483417642532864,0,0
2/10/11 18:42,Fidalgo Country Inn Anacortes Anacortes http://reservation.travelaffiliatepro.com/hotel/details/MS6616,TraAffiliatePro,3.58461E+16,https://twitter.com/TraAffiliatePro/status/35846142344306688,0,0
2/11/11 18:56,"I'm at Hilton Garden Inn Riverhead (2038 OLD COUNTRY ROAD, Riverhead) http://4sq.com/feyL4M",fattyjeff,3.6212E+16,https://twitter.com/fattyjeff/status/36211980851220480,0,0
2/12/11 18:55,RT @ Summyr1988: Looking for lodging in Atlanta for # frofashionweek< check country inn suites and ramada on virgina ave,NaturalMeMedia,3.65742E+16,https://twitter.com/NaturalMeMedia/status/36574190744109057,1,0
2/13/11 18:24,provide a roadmap: 解決策を示すIt provides a roadmap for developing a successful enterprise in the country with step by step instructions. # kcafe,u_inn,3.69287E+16,https://twitter.com/u_inn/status/36928710552731648,0,0
2/14/11 18:58,@SmokahontasBLAK I'm at IHOP right now but I'm staying at the Country Inn,weednation,3.72997E+16,https://twitter.com/weednation/status/37299745290461184,0,0
2/15/11 18:58,Country Inn Suites Erie Erie http://reservation.travelaffiliatepro.com/hotel/details/CX7109,TraAffiliatePro,3.76621E+16,https://twitter.com/TraAffiliatePro/status/37662075798949888,0,0
2/16/11 18:55,"Add Maryland to my state not to do list, Time is dragging, im hungry, weight inn ain't till 4 tomorrow & its cold n country # ThisAintIt",JosephElegele,3.80237E+16,https://twitter.com/JosephElegele/status/38023732337311744,0,0
2/17/11 18:59,"I'm at Country Inn & Suites (5808 Burton Station Rd, Virginia Beach) http://4sq.com/f0OZMF",Bigdog27215,3.8387E+16,https://twitter.com/Bigdog27215/status/38387002353258496,0,0
2/18/11 18:56,@ tweetforsales Variety of Zatarain Rices & Uncle Ben Country Inn Rices - 10for$10 at Winn Dixie until 02/22. STOCK UP!!,aLady4Christ,3.87487E+16,https://twitter.com/aLady4Christ/status/38748693993627648,0,0
2/19/11 18:29,Country Inn Ste Camp Springs Camp Springs http://reservation.travelaffiliatepro.com/hotel/details/CX7285,TraAffiliatePro,3.91044E+16,https://twitter.com/TraAffiliatePro/status/39104398613417985,0,0
2/20/11 18:13,home sweet Country Inn and Suites. http://twitpic.com/420n6i,bridgie24,3.94628E+16,https://twitter.com/bridgie24/status/39462790884229120,0,0
2/21/11 18:52,"I'm at Premier Inn Wemouth (Lodmoor Country Park, Weymouth, Dorset DT4 7SX) http://4sq.com/g2zPro",jon_stuckey,3.98348E+16,https://twitter.com/jon_stuckey/status/39834789104193537,0,0
2/22/11 18:59,Americas Best Value Inn Suites Wine Country Santa Rosa http://j.mp/fM5qur,intunneljord,4.01989E+16,https://twitter.com/intunneljord/status/40198933758214144,0,0
2/23/11 18:11,"I'm at Tubac Country Inn (13 Burruel St, Tubac) http://4sq.com/h86mod",pattipdx,4.05493E+16,https://twitter.com/pattipdx/status/40549276069138433,0,0
2/24/11 18:37,"The Oxford House Inn (Fryeburg, Maine): Charming country Inn/Bed & Breakfast with a gourmet restaurant and spect... http://bit.ly/if9rJt",advanticatravel,4.09183E+16,https://twitter.com/advanticatravel/status/40918313483640832,0,0
2/25/11 18:59,En Panamá (: (@Country Inn El Dorado) http://4sq.com/fSmMEv,Kasanizo,4.12861E+16,https://twitter.com/Kasanizo/status/41286101905838080,0,0
2/26/11 18:57,Congratulations Nakea Richardson was the first to get her IMPACT CONFERENCE ticket & 1st to get her Hotel reservation at the Country Inn!,Jack_Hendricks,4.1648E+16,https://twitter.com/Jack_Hendricks/status/41647981283393536,0,0
2/27/11 18:13,Country Inn & Suites Mont Tremblant- Earn Free Nights the Longer you Stay! http://bit.ly/fcoN1g,SnowSkiDealsCA,4.19993E+16,https://twitter.com/SnowSkiDealsCA/status/41999293929754624,0,0
2/28/11 18:04,"I'm at Rips Country Inn (Rt 197 and Rt 301, Bowie) http://4sq.com/hahjKE",MarkSchmark,4.23594E+16,https://twitter.com/MarkSchmark/status/42359393286750208,0,0
3/1/11 18:45,@MillerizLizz By the country inn right now...,CapnHolly_,4.27322E+16,https://twitter.com/CapnHolly_/status/42732248868466688,0,0
3/2/11 18:26,"Wrapped up a shortened work week, now heading to The Whee. (@The Swag Country Inn) http://4sq.com/i37alz",CSNCat,4.30897E+16,https://twitter.com/CSNCat/status/43089721659899904,0,0
3/3/11 18:18,Country Inn Stes Princeton Princeton http://reservation.travelaffiliatepro.com/hotel/details/CX7378,TraAffiliatePro,4.34501E+16,https://twitter.com/TraAffiliatePro/status/43450095420715008,0,0
3/4/11 18:58,"National Artist Bret Michaels | Medina Entertainment Center www.medinaentertainment.com Saturday, April 2, 2011... http://fb.me/M6seApO1",CountryInn_PLYH,4.38227E+16,https://twitter.com/CountryInn_PLYH/status/43822742138654720,0,0
3/5/11 18:16,"I'm at Country Inn & Suites (800 Sidney Marcus Blvd, Atlanta) http://4sq.com/eIarUE",Dreveli,4.41745E+16,https://twitter.com/Dreveli/status/44174511326773248,0,0
3/6/11 18:02,Steak and eggs with my sis! (@Holder's Country Inn) [pic]: http://4sq.com/heNM0K,TinaHui,4.45334E+16,https://twitter.com/TinaHui/status/44533433757745153,0,0
3/7/11 18:54,@ CaseyGraham we are safe and sound at the country inn and suites.,jeffkapusta,4.49087E+16,https://twitter.com/jeffkapusta/status/44908688309358595,0,0
3/8/11 18:47,四季折々の香と彩りのガーデンペンション country Inn カナディアンハウス http://bit.ly/cD0qGx # niigata # myoko # pensionJP # choi2,choi2Search,4.52694E+16,https://twitter.com/choi2Search/status/45269397446733825,0,0
3/9/11 17:48,GOT AN INTERVIEW @THE COUNTRY INN & SUITES!! YAY...LOL,PrettyNatural87,4.56169E+16,https://twitter.com/PrettyNatural87/status/45616941259436032,0,0
3/10/11 18:00,Flight cancelled to home. Spending the night on Delta! (@Country Inn And Suites Airport South Atlanta (Georgia)) http://4sq.com/efJ43e,rlervin58,4.59824E+16,https://twitter.com/rlervin58/status/45982448697352192,0,0
3/11/11 18:59,@ Illmana bare In mind I've been inn the country 7 years looool italians don't knw bout no kat lol,FlaviaAsante,4.63596E+16,https://twitter.com/FlaviaAsante/status/46359635602583552,0,0
3/12/11 18:55,"I'm at Rips Country Inn (Rt 197 and Rt 301, Bowie) http://4sq.com/g7kxJR",styleZbyMYKAL,4.67211E+16,https://twitter.com/styleZbyMYKAL/status/46721091841957888,0,0
3/13/11 18:34,@ SethEmerson stay in south park best Hampton Inn in the country there.,claycamp,4.70631E+16,https://twitter.com/claycamp/status/47063082249367552,0,0
3/14/11 19:59,"Copper Mining in Zambia: Zambia is most famous for its reserves of copper and cobalt, however, the country is al... http://bit.ly/i0MXlv",INN_Copper,4.74467E+16,https://twitter.com/INN_Copper/status/47446701694394369,0,0
3/15/11 19:57,"@ amandamhines sure...what about Country Garden Inn & Spa in Rowley, MA? Great specials...interested?",CGinnandspa,4.78086E+16,https://twitter.com/CGinnandspa/status/47808629235122176,0,0
3/16/11 19:55,Hamlet Inn coming soon to S.B. wine country ! - http://fwix.com/a/82_d21971ceb0,Barbaralocal,4.81705E+16,https://twitter.com/Barbaralocal/status/48170474462654464,0,0
3/17/11 18:58,"3 night Country Inn and Suites Ontario Airport: Source: www.sportstraveler.net --- Thursday, March 17, 2011Three... http://bit.ly/hxjXHJ",lojapang,4.85186E+16,https://twitter.com/lojapang/status/48518621911203840,0,0
3/18/11 19:49,"I'm at Cafe Cimino Country Inn (616 Main Street, Sutton) http://4sq.com/fKe012",MichelleJBerti,4.88939E+16,https://twitter.com/MichelleJBerti/status/48893940639858688,0,0
3/19/11 19:12,Ok what is there to do tonight? (@Country Inn & Suites North Duluth (Minnesota)) http://4sq.com/g8Mkno,Tracie411,4.9247E+16,https://twitter.com/Tracie411/status/49246984762167296,0,0
3/20/11 19:39,mesaparkwines: RT @CanyonWindWines: Enjoying a great afternoon of fine Colorado wine+yummy food at the Edesia event at the Wine Country Inn!,MikesMRwineguy,4.96161E+16,https://twitter.com/MikesMRwineguy/status/49616102979940352,0,0
3/21/11 19:47,"This weekend an exclusive chance to hear songs from the new album and rockin country as I hit the Westbrook Inn Fri, and Sat only! Come down",jerrysereda,4.99805E+16,https://twitter.com/jerrysereda/status/49980506351206400,0,0
3/22/11 19:21,"Save 50% at The Homespun Country Inn in Nappanee, IN, Indiana: http://bit.ly/i7nStU",BnBDeals,5.03364E+16,https://twitter.com/BnBDeals/status/50336421365555200,0,0
3/23/11 19:42,"I'm at The Country Inn (Romeo Plank, 23 Mile) http://4sq.com/gZQsdZ",johnpwilton,5.07039E+16,https://twitter.com/johnpwilton/status/50703913560707072,0,0
3/24/11 19:52,http://bit.ly/fYVz0a RT @CountryInn_SCAL2011Spring is here!! Leap into savings with our Great America Package fo... http://bit.ly/fYVz0a,noahproductions,5.1069E+16,https://twitter.com/noahproductions/status/51069027614859264,0,0
3/25/11 19:50,Temet Grill at Temecula Creek Inn is now accepting resos for Easter Brunch! Dine with us in So Cal Wine Country! http://ow.ly/4lRrG,JCResortsSoCal,5.14307E+16,https://twitter.com/JCResortsSoCal/status/51430684270665728,0,0
3/26/11 19:07,"I'm at Country Inn Suites (Gateway Center Blvd, Brunswick) http://4sq.com/hZ8lQa",novelty_sewer,5.17824E+16,https://twitter.com/novelty_sewer/status/51782440754221056,0,0
3/27/11 19:53,"I'm at Country Inn & Suites Newport News (1069 J Clyde Morris Blvd, Newport News) http://4sq.com/eKKMBA",CasaNoVApsu,5.21564E+16,https://twitter.com/CasaNoVApsu/status/52156397349117952,0,0
3/28/11 19:58,"I'm at Country Inn & Suites Clive, IA (1350 NW 118th St, University Ave, Clive) http://4sq.com/hkRSN6",kahough78,5.25201E+16,https://twitter.com/kahough78/status/52520068063559681,0,0
3/31/11 18:00,Last chance to win an overnight stay at the Country Inn and Suites. Listen to 107.7 tomorrow morning!,dinegettysburg,5.35775E+16,https://twitter.com/dinegettysburg/status/53577464043155456,0,0
4/1/11 19:58,$89 for a One-Night Stay and Country Breakfast at North Glade Inn Bed & Breakfast at De...: http://j.mp/fHep0n << last call for this Groupon,PittsburghMaps,5.39696E+16,https://twitter.com/PittsburghMaps/status/53969582318301184,0,0
4/2/11 19:51,Applesauce Inn Bed & Breakfast: Planning an April Country Inn Getaway? Check out... http://applesauceinn.blogspot.com/2011/03/planning-april-country-inn-getaway_22.html?spref=tw … ~Come meet Angel the Kid,ApplesauceInn,5.43301E+16,https://twitter.com/ApplesauceInn/status/54330068129943552,0,0
4/4/11 19:32,"I'm at Country Inn By Carlson, Grand Rapids (2601 S Highway 169, Grand Rapids) http://4sq.com/hVCpjR",ChrisInKnox,5.50502E+16,https://twitter.com/ChrisInKnox/status/55050230344851456,0,0
4/5/11 19:22,3-Star Country Inn & Suites Jalandhar Fr $93+/Nt: http://bit.ly/99mX1h,KellyHowells,5.541E+16,https://twitter.com/KellyHowells/status/55410036989628416,0,0
4/6/11 19:47,Hotels Sleep Inn Amherst – Amherst (New York) Country Inns http://goo.gl/fb/K5hg1,CheapHotelBreak,5.57787E+16,https://twitter.com/CheapHotelBreak/status/55778697554305024,0,0
4/7/11 19:30,"# Reading Overnight Stay for Two, Plus Breakfast and Bottle of Wine for £39 at The Bird in Hand Country Inn (Wort... http://bit.ly/gIDKmH",DealcollectorUK,5.61369E+16,https://twitter.com/DealcollectorUK/status/56136922338312192,0,0
4/8/11 19:56,"Engaged couples, local groups forced to scramble after Country Comfort Inn and ...: Mortgage holder T&C Inn LLC ... http://bit.ly/epgFx4",PRO_Legal,5.65057E+16,https://twitter.com/PRO_Legal/status/56505680751902720,0,0
4/9/11 18:37,The federal Yukon NDP has a great event planned for tomorrow 668-2203 or drop by the office at 3051 3rd Ave (behind the High Country Inn),Mikedobson19,5.68482E+16,https://twitter.com/Mikedobson19/status/56848199645790209,0,0
4/10/11 19:52,Yeah buddy (@White Bear Country Inn w/ 2 others) [pic]: http://4sq.com/hs6XkS,IamJtotheP,5.72296E+16,https://twitter.com/IamJtotheP/status/57229622244417536,0,0
4/11/11 19:19,I just became the mayor of Country Inn & Suites on @ foursquare! http://4sq.com/asxCab,vmcbrayer,5.75837E+16,https://twitter.com/vmcbrayer/status/57583671976275968,0,0
4/12/11 19:57,"@Auberge de Seattle French Country Inn w/ Bradley Sherman, Nancy Douglas, David Coan http://yfrog.com/h3wgfckj",kirklandwinegal,5.79556E+16,https://twitter.com/kirklandwinegal/status/57955594266611712,0,0
4/13/11 19:51,Free contest to win Summer Music Series tickets and Highfield Country Inn and Spa package . Ballots @Station Gallery http://bit.ly/hKJA5o,Judy_wordcounts,5.83163E+16,https://twitter.com/Judy_wordcounts/status/58316323289169920,0,0
4/14/11 19:33,"This Saturday, Oil Can Harry @Perl's Country Inn in St. Peter/Malone: GRAND OPENING for the full kitchen and new... http://fb.me/Jw6gp9iC",OCHRocks,5.86743E+16,https://twitter.com/OCHRocks/status/58674264341102593,0,0
4/15/11 19:51,"New hotels Twitter buzz: http://sch.mp/aTUp - RT @ CountryInnDVAZ 2 Free Diamondbacks tickets when you ""LIKE"" Country Inn & Suit...",Phoenix_Places,5.90412E+16,https://twitter.com/Phoenix_Places/status/59041160307552256,0,0
4/16/11 19:50,"I'm at Country Inn & Suites By Carlson Austin-North (7400 N I H 35, Austin) http://4sq.com/eZkJlV",calmond,5.94034E+16,https://twitter.com/calmond/status/59403372503117824,0,0
4/17/11 19:51,–country hotels and innsDo Best Western Country Inn hotels have … & Country Inns http://goo.gl/fb/OxJMd,CountryInnHotel,5.97659E+16,https://twitter.com/CountryInnHotel/status/59765925821431808,0,0
4/18/11 19:37,"I'm at High Hampton Inn & Country Club (1525 Hwy 107 S Cashiers NC 28717 USA, Cashiers) http://4sq.com/eorOcH",birddogpress,6.01248E+16,https://twitter.com/birddogpress/status/60124834318913536,0,0
4/19/11 19:45,SAVE up to 33% at the Hill Country Inn And Suites At Salado Creek Villas in San Antonio on CheapTickets .com!... http://c69.us/dSwHyO # ad,frostilycourt,6.04892E+16,https://twitter.com/frostilycourt/status/60489202533548032,0,0
4/20/11 18:38,"Brainerd MN discount lodging options, Baxter MN best discount … — Country Inn http://goo.gl/fb/HrEl4",CheapHotelBreak,6.08348E+16,https://twitter.com/CheapHotelBreak/status/60834782900264960,0,0
4/21/11 19:44,Exquisite Country Inn w/Full Commercial Kitchen http://bit.ly/hL55jq # business # sale,businessreel,6.12136E+16,https://twitter.com/businessreel/status/61213645891309568,0,0
4/22/11 19:42,SAVE up to 33% at the Hill Country Inn And Suites At Salado Creek Villas in San Antonio on CheapTickets .com!... http://c69.us/dSwHyO,frostilycourt,6.15757E+16,https://twitter.com/frostilycourt/status/61575721017016320,0,0
4/23/11 19:57,Leisure Country Inn Branson – shells-for.sheilaefatyai.co.cc – country inn branson http://goo.gl/fb/Htq30,CountryInnHotel,6.19418E+16,https://twitter.com/CountryInnHotel/status/61941759407693824,0,0
4/24/11 18:46,SAVE up to 33% at the Hill Country Inn And Suites At Salado Creek Villas in San Antonio on CheapTickets .com!... http://c69.us/dSwHyO,frostilycourt,6.22863E+16,https://twitter.com/frostilycourt/status/62286278657458177,0,0
4/25/11 19:53,Country Inn and Suites Roselle: Country Inn and Suites Roselle > > 1490 W Lake Street > Roselle > IL > 60... http://bit.ly/g7PD50 # Bulls,Da_Davies,6.26655E+16,https://twitter.com/Da_Davies/status/62665459446710273,0,0
4/26/11 19:25,RT @CountryInn_Wtn Country Inn & Suites will be hosting a after 5 social. We will keep you posted on time and d... http://schmap.it/BlS04m?a,PlacesSD,6.3021E+16,https://twitter.com/PlacesSD/status/63020967479361537,0,0
4/27/11 19:47,This is the nicest Country Inn & Suites I've ever stayed in! Highly recommended. :),calmond,6.33889E+16,https://twitter.com/calmond/status/63388948097015810,0,0
4/28/11 19:55,# youratypaheadwhen you claim puerto rico's a country.USA's commonwealth ! Imsorry I got pride in myCOUNTRY @miamoreterno_x3 @ThissJustt_Inn,ElSupreme_,6.37534E+16,https://twitter.com/ElSupreme_/status/63753350029647873,0,0
4/30/11 19:39,Tour Rapid City's Country Inn and Suites Hotel Online | Isis … ** country inn and suites… http://goo.gl/fb/lLTWi,CountryInnHotel,6.4474E+16,https://twitter.com/CountryInnHotel/status/64474028810842112,0,0
5/1/11 19:16,Was out with friends late afternoon for coffee and pastry at a local country inn.,spamless,6.48305E+16,https://twitter.com/spamless/status/64830521980628993,0,0
5/2/11 19:41,@mikeberbick23 @ quayb3 @Yeiyoo @Taajilaquan215 she also said country yard hilton or ramda inn,MiaMiaSamia,6.51991E+16,https://twitter.com/MiaMiaSamia/status/65199148638552064,0,0
5/3/11 19:42,R4 Holiday Inn Guayaquil-Airport Breaks Ground in Ecuador | IHG’s Second Hotel in the Country http://nxy.in/5hokg @ EDconsulting_,_EDconsulting,6.55618E+16,https://twitter.com/_EDconsulting/status/65561828897456128,0,0
5/4/11 19:55,I'm at Country Chase Fountain Inn (Fountain Inn) http://4sq.com/jRC9KY,txwoman4,6.59276E+16,https://twitter.com/txwoman4/status/65927620855988224,0,0
